[{"id":"b4-001","name":"Wurmple","set_code":"b4","type":"Pokémon","subtype":"Grass","stage":"Basic","health":60,"retreat":1,"weakness":"Fire","ability":{"exists":false,"name":null,"effect":null},"attacks":{"1":{"cost":"C","name":"Gnaw","damage":10,"effect":null},"2":{"cost":null,"name":null,"damage":null,"effect":null}},"points":1,"ex":false,"mega":false,"deckBuilderNr":1962},{"id":"b4-002","name":"Silcoon","set_code":"b4","type":"Pokémon","subtype":"Grass","stage":"Stage 1","evolves_from":"Wurmple","health":80,"retreat":3,"weakness":"Fire","ability":{"exists":false,"name":null,"effect":null},"attacks":{"1":{"cost":"C","name":"Cocoon Collector","damage":null,"effect":"Put 3 random cards from among Silcoon and Cascoon from your deck onto your Bench."},"2":{"cost":null,"name":null,"damage":null,"effect":null}},"points":1,"ex":false,"mega":false,"deckBuilderNr":1963},{"id":"b4-003","name":"Beautifly","set_code":"b4","type":"Pokémon","subtype":"Grass","stage":"Stage 2","evolves_from":"Silcoon","health":130,"retreat":1,"weakness":"Fire","ability":{"exists":false,"name":null,"effect":null},"attacks":{"1":{"cost":"G","name":"Evoflight","damage":30,"effect":"This attack does 30 more damage for each Evolution Pokémon on your Bench."},"2":{"cost":null,"name":null,"damage":null,"effect":null}},"points":1,"ex":false,"mega":false,"deckBuilderNr":1964},{"id":"b4-004","name":"Cascoon","set_code":"b4","type":"Pokémon","subtype":"Grass","stage":"Stage 1","evolves_from":"Wurmple","health":80,"retreat":3,"weakness":"Fire","ability":{"exists":false,"name":null,"effect":null},"attacks":{"1":{"cost":"C","name":"Cocoon Collector","damage":null,"effect":"Put 3 random cards from among Silcoon and Cascoon from your deck onto your Bench."},"2":{"cost":null,"name":null,"damage":null,"effect":null}},"points":1,"ex":false,"mega":false,"deckBuilderNr":1965},{"id":"b4-005","name":"Dustox","set_code":"b4","type":"Pokémon","subtype":"Grass","stage":"Stage 2","evolves_from":"Cascoon","health":120,"retreat":1,"weakness":"Fire","ability":{"exists":true,"name":"Variety Powder","effect":"Once during your turn, you may use this Ability. 1 Special Condition from among Burned, Confused, and Poisoned is chosen at random, and your opponent's Active Pokémon is now affected by that Special Condition. Any Special Conditions already affecting that Pokémon will not be chosen."},"attacks":{"1":{"cost":"CC","name":"Cutting Wind","damage":60,"effect":null},"2":{"cost":null,"name":null,"damage":null,"effect":null}},"points":1,"ex":false,"mega":false,"deckBuilderNr":1966},{"id":"b4-006","name":"Lileep","set_code":"b4","type":"Pokémon","subtype":"Grass","stage":"Stage 1","evolves_from":"Root Fossil","health":90,"retreat":2,"weakness":"Fire","ability":{"exists":false,"name":null,"effect":null},"attacks":{"1":{"cost":"G","name":"Blot","damage":40,"effect":"Heal 10 damage from this Pokémon."},"2":{"cost":null,"name":null,"damage":null,"effect":null}},"points":1,"ex":false,"mega":false,"deckBuilderNr":1967},{"id":"b4-007","name":"Cradily","set_code":"b4","type":"Pokémon","subtype":"Grass","stage":"Stage 2","evolves_from":"Lileep","health":150,"retreat":3,"weakness":"Fire","ability":{"exists":false,"name":null,"effect":null},"attacks":{"1":{"cost":"GG","name":"Stick and Absorb","damage":70,"effect":"Heal 30 damage from this Pokémon. During your opponent's next turn, the Defending Pokémon can't retreat."},"2":{"cost":null,"name":null,"damage":null,"effect":null}},"points":1,"ex":false,"mega":false,"deckBuilderNr":1968},{"id":"b4-008","name":"Kricketot","set_code":"b4","type":"Pokémon","subtype":"Grass","stage":"Basic","health":60,"retreat":1,"weakness":"Fire","ability":{"exists":false,"name":null,"effect":null},"attacks":{"1":{"cost":"C","name":"Beat","damage":10,"effect":null},"2":{"cost":null,"name":null,"damage":null,"effect":null}},"points":1,"ex":false,"mega":false,"deckBuilderNr":1969},{"id":"b4-009","name":"Kricketune","set_code":"b4","type":"Pokémon","subtype":"Grass","stage":"Stage 1","evolves_from":"Kricketot","health":90,"retreat":1,"weakness":"Fire","ability":{"exists":false,"name":null,"effect":null},"attacks":{"1":{"cost":"G","name":"Bug Buzz","damage":50,"effect":null},"2":{"cost":null,"name":null,"damage":null,"effect":null}},"points":1,"ex":false,"mega":false,"deckBuilderNr":1970},{"id":"b4-010","name":"Combee","set_code":"b4","type":"Pokémon","subtype":"Grass","stage":"Basic","health":50,"retreat":1,"weakness":"Fire","ability":{"exists":false,"name":null,"effect":null},"attacks":{"1":{"cost":"G","name":"Reckless Charge","damage":30,"effect":"This Pokémon also does 10 damage to itself."},"2":{"cost":null,"name":null,"damage":null,"effect":null}},"points":1,"ex":false,"mega":false,"deckBuilderNr":1971},{"id":"b4-011","name":"Vespiquen ex","set_code":"b4","type":"Pokémon","subtype":"Grass","stage":"Stage 1","evolves_from":"Combee","health":140,"retreat":2,"weakness":"Fire","ability":{"exists":false,"name":null,"effect":null},"attacks":{"1":{"cost":"GG","name":"Chase Order","damage":70,"effect":"You may discard 1 of your Benched Basic [G] Pokémon. If you do, this attack does 70 more damage."},"2":{"cost":null,"name":null,"damage":null,"effect":null}},"points":2,"ex":true,"mega":false,"deckBuilderNr":1972},{"id":"b4-012","name":"Karrablast","set_code":"b4","type":"Pokémon","subtype":"Grass","stage":"Basic","health":60,"retreat":1,"weakness":"Fire","ability":{"exists":false,"name":null,"effect":null},"attacks":{"1":{"cost":"CC","name":"Peck","damage":30,"effect":null},"2":{"cost":null,"name":null,"damage":null,"effect":null}},"points":1,"ex":false,"mega":false,"deckBuilderNr":1973},{"id":"b4-013","name":"Shelmet","set_code":"b4","type":"Pokémon","subtype":"Grass","stage":"Basic","health":70,"retreat":3,"weakness":"Fire","ability":{"exists":false,"name":null,"effect":null},"attacks":{"1":{"cost":"C","name":"Seashell Attack","damage":20,"effect":null},"2":{"cost":null,"name":null,"damage":null,"effect":null}},"points":1,"ex":false,"mega":false,"deckBuilderNr":1974},{"id":"b4-014","name":"Accelgor","set_code":"b4","type":"Pokémon","subtype":"Grass","stage":"Stage 1","evolves_from":"Shelmet","health":80,"retreat":1,"weakness":"Fire","ability":{"exists":false,"name":null,"effect":null},"attacks":{"1":{"cost":"CC","name":"Deck and Cover","damage":50,"effect":"Your opponent's Active Pokémon is now Poisoned and Paralyzed. Shuffle this Pokémon and all attached cards into your deck."},"2":{"cost":null,"name":null,"damage":null,"effect":null}},"points":1,"ex":false,"mega":false,"deckBuilderNr":1975},{"id":"b4-015","name":"Dhelmise","set_code":"b4","type":"Pokémon","subtype":"Grass","stage":"Basic","health":110,"retreat":2,"weakness":"Fire","ability":{"exists":false,"name":null,"effect":null},"attacks":{"1":{"cost":"GGC","name":"Spinning Attack","damage":70,"effect":null},"2":{"cost":null,"name":null,"damage":null,"effect":null}},"points":1,"ex":false,"mega":false,"deckBuilderNr":1976},{"id":"b4-016","name":"Pheromosa","set_code":"b4","type":"Pokémon","subtype":"Grass","stage":"Basic","special_tags":["ultra_beasts"],"health":70,"retreat":1,"weakness":"Fire","ability":{"exists":false,"name":null,"effect":null},"attacks":{"1":{"cost":"GG","name":"Prelude","damage":30,"effect":"If you haven't gotten any points, this attack does 60 more damage."},"2":{"cost":null,"name":null,"damage":null,"effect":null}},"points":1,"ex":false,"mega":false,"deckBuilderNr":1977},{"id":"b4-017","name":"Poltchageist","set_code":"b4","type":"Pokémon","subtype":"Grass","stage":"Basic","health":40,"retreat":1,"weakness":"Fire","ability":{"exists":true,"name":"Hospitality","effect":"Once during your turn, when you put this Pokémon from your hand onto your Bench, you may heal 20 damage from your Active [G] Pokémon."},"attacks":{"1":{"cost":"G","name":"Spray Fluid","damage":10,"effect":null},"2":{"cost":null,"name":null,"damage":null,"effect":null}},"points":1,"ex":false,"mega":false,"deckBuilderNr":1978},{"id":"b4-018","name":"Sinistcha","set_code":"b4","type":"Pokémon","subtype":"Grass","stage":"Stage 1","evolves_from":"Poltchageist","health":80,"retreat":1,"weakness":"Fire","ability":{"exists":false,"name":null,"effect":null},"attacks":{"1":{"cost":"GC","name":"Scald","damage":40,"effect":"Your opponent's Active Pokémon is now Burned."},"2":{"cost":null,"name":null,"damage":null,"effect":null}},"points":1,"ex":false,"mega":false,"deckBuilderNr":1979},{"id":"b4-019","name":"Teal MaskOgerpon","set_code":"b4","type":"Pokémon","subtype":"Grass","stage":"Basic","health":90,"retreat":1,"weakness":"Fire","ability":{"exists":false,"name":null,"effect":null},"attacks":{"1":{"cost":"GGC","name":"Ogre’s Whip","damage":null,"effect":"This attack does damage to your opponent's Active Pokémon equal to this Pokémon's remaining HP."},"2":{"cost":null,"name":null,"damage":null,"effect":null}},"points":1,"ex":false,"mega":false,"deckBuilderNr":1980},{"id":"b4-020","name":"Ponyta","set_code":"b4","type":"Pokémon","subtype":"Fire","stage":"Basic","health":60,"retreat":1,"weakness":"Water","ability":{"exists":false,"name":null,"effect":null},"attacks":{"1":{"cost":"R","name":"Stoke","damage":null,"effect":"Take a [R] Energy from your Energy Zone and attach it to this Pokémon."},"2":{"cost":null,"name":null,"damage":null,"effect":null}},"points":1,"ex":false,"mega":false,"deckBuilderNr":1981},{"id":"b4-021","name":"Rapidash","set_code":"b4","type":"Pokémon","subtype":"Fire","stage":"Stage 1","evolves_from":"Ponyta","health":110,"retreat":1,"weakness":"Water","ability":{"exists":false,"name":null,"effect":null},"attacks":{"1":{"cost":"RRC","name":"Heat Blast","damage":80,"effect":null},"2":{"cost":null,"name":null,"damage":null,"effect":null}},"points":1,"ex":false,"mega":false,"deckBuilderNr":1982},{"id":"b4-022","name":"Flareon","set_code":"b4","type":"Pokémon","subtype":"Fire","stage":"Stage 1","evolves_from":"Eevee","health":110,"retreat":2,"weakness":"Water","ability":{"exists":false,"name":null,"effect":null},"at